{
  "run_id": "3d981e919a1d",
  "job_id": "example-fix-checker",
  "status": "aborted",
  "started_at": "2026-07-02T02:13:57.459328+00:00",
  "finished_at": "",
  "duration_seconds": 0.0,
  "iterations": 0,
  "max_iterations": 3,
  "branch": "",
  "isolation_mode": "branch",
  "plan": {},
  "gate_decisions": [],
  "agent_results": [],
  "verification_results": [],
  "diff_stat": "",
  "diff_summary": {},
  "evidence": {},
  "repro_bundle": {},
  "reproduce_commands": [],
  "rollback_command": "",
  "remaining_risks": [],
  "errors": [
    "工作区有未提交修改:\nM scripts/codex_supervisor.py\n?? .codex/jobs/\n?? .codex/runs/\n?? .codex/schemas/gate_decision.schema.json\n?? .codex/schemas/job.schema.json\n?? .codex/schemas/supervisor_report.schema.json\n\n请先 commit/stash 或在 job 中设置 require_clean_worktree=false"
  ],
  "warnings": [],
  "log_path": ""
}